{
  "$schema": "http://json-schema.org/draft-07/schema#",
  "$id": "https://schemas.pedantic.dev/contracts/v1/operation-event.schema.json",
  "title": "Pedantic immutable operation event",
  "type": "object",
  "additionalProperties": false,
  "required": ["schemaVersion", "eventId", "eventType", "resultingState", "operationId", "planId", "profileId", "actorId", "targetId", "agentId", "causationId", "correlationId", "sequence"],
  "properties": {
    "schemaVersion": { "const": "pedantic.operation-event.v1" },
    "eventId": { "$ref": "#/definitions/id" },
    "eventType": { "enum": ["operation.requested", "operation.admitted", "operation.rejected", "operation.authorized", "operation.cancelled", "operation.terminated_with_cleanup_required", "cleanup.verified", "preparation.started", "preparation.completed", "step.offered", "step.leased", "step.started", "step.progressed", "step.heartbeat", "step.suspended", "step.resumed", "step.reboot_requested", "step.reboot_observed", "step.completed", "step.failed", "step.verification_failed", "step.needs_review", "operation.succeeded", "operation.partial", "operation.verification_failed", "operation.failed", "evidence.finalized"] },
    "resultingState": { "$ref": "#/definitions/state" },
    "operationId": { "$ref": "#/definitions/id" },
    "planId": { "$ref": "#/definitions/id" },
    "stepId": { "$ref": "#/definitions/id" },
    "attemptId": { "$ref": "#/definitions/id" },
    "commandId": { "$ref": "#/definitions/id" },
    "authorizationId": { "$ref": "#/definitions/id" },
    "idempotencyKey": { "$ref": "#/definitions/id" },
    "profileId": { "$ref": "#/definitions/id" },
    "actorId": { "$ref": "#/definitions/id" },
    "targetId": { "$ref": "#/definitions/id" },
    "agentId": { "$ref": "#/definitions/id" },
    "causationId": { "$ref": "#/definitions/id" },
    "correlationId": { "$ref": "#/definitions/id" },
    "sequence": { "type": "integer", "minimum": 1 },
    "occurredAt": { "type": "integer", "minimum": 0 }
  },
  "definitions": {
    "id": { "type": "string", "minLength": 1, "maxLength": 256 },
    "state": { "enum": ["Requested", "Admitted", "Authorized", "Preparing", "Prepared", "Queued", "Running", "Waiting", "AwaitingReboot", "NeedsReview", "Succeeded", "Partial", "VerificationFailed", "Failed", "Cancelled", "TerminatedWithCleanupRequired"] }
  }
}
