{
  "schemaVersion": "pedantic.operation-event.v1",
  "eventId": "event-1",
  "eventType": "operation.admitted",
  "resultingState": "Admitted",
  "operationId": "operation-1",
  "planId": "plan-1",
  "profileId": "default",
  "actorId": "user-1",
  "targetId": "target-1",
  "agentId": "agent-1",
  "causationId": "cause-1",
  "correlationId": "correlation-1",
  "sequence": 1,
  "occurredAt": 1
}
